{
  "case_id": "SHRGT45-REPLAY-001",
  "manifest_version": "0.1.0",
  "schema_version": "0.1.0",
  "mode": "REPLAY",
  "research_question_ref": {
    "id": "RQ-SHRGT45-001",
    "schema_version": "0.1.0",
    "content_hash": "E73DB0BF9155A9C4A0F1A369D97DE318BD58D37EDC9002ABBE9354F6377FD88E"
  },
  "workflow_version": "0.1.0",
  "stage_asset_refs": {
    "S01_CANDIDATE": [
      {
        "id": "s01.current-research-constraints",
        "schema_version": "0.1.0",
        "content_hash": "AFB549655D666FDA2CF47998FAF02D873FD951B72B6EFDD99533C09DBB4B9A9F"
      },
      {
        "id": "s01.parameter-ranking-current-state",
        "schema_version": "0.1.0",
        "content_hash": "FCB55487F63813E05FE9B1C946524B9D88585BB65CF84DD346BE44C61900733B"
      }
    ],
    "S02_MECHANISM": [
      {
        "id": "s02.mechanism-brief-v2_3",
        "schema_version": "0.1.0",
        "content_hash": "6068139E85EA18B12561D2A91B1F5480317AE10131583776ADEA82AB580CBCD7"
      },
      {
        "id": "s02.mechanism-brief-v2_2-historical",
        "schema_version": "0.1.0",
        "content_hash": "A07A7D71A1F33329447119528E1F204E6B328516AB00F1EB696C9A1D3B87F493"
      },
      {
        "id": "s02.agent-run-phase2-20260814",
        "schema_version": "0.1.0",
        "content_hash": "FAD21066578913C25BB7649B0044773E21C1898FFABE987300F7FDDFEDEF6E25"
      },
      {
        "id": "s02.mechanism-human-summary",
        "schema_version": "0.1.0",
        "content_hash": "7C441CA33616317FF7F418277A73DA954E27461116042411781E9E485C740E26"
      }
    ],
    "S03_HYPOTHESIS": [
      {
        "id": "s03.hypothesis-baseline",
        "schema_version": "0.1.0",
        "content_hash": "EB0BDB3F537360EB6CFAC969519BE1D702F0B63A7356C8671F13365931E7D969"
      },
      {
        "id": "s03.trend-method-theil-sen",
        "schema_version": "0.1.0",
        "content_hash": "1AF17CE5450DA119118FA8A872D9280E89B1FCC63FF2CD7AA84C3B6EAB7A36AE"
      },
      {
        "id": "s03.hamed-rao-spec",
        "schema_version": "0.1.0",
        "content_hash": "BDC20761E3D67B7EDE460A70EF52D41A04629572A849EBFCE615E4E2E4F758DC"
      },
      {
        "id": "s03.hamed-rao-calibration-report",
        "schema_version": "0.1.0",
        "content_hash": "95408712C2D706C587B9D9FD5F55500FF9F2718FC5CE1B735676EE52877E25C4"
      },
      {
        "id": "s03.hamed-rao-calibration-summary",
        "schema_version": "0.1.0",
        "content_hash": "CD07551257F3A948254E60D956213F3844A3FF705BA192F81D87F28E19CBFF75"
      },
      {
        "id": "s03.hamed-rao-run-metadata",
        "schema_version": "0.1.0",
        "content_hash": "4504C415E4BCC89850E555065AE9BB23502BC53F431DBA756288F14B23B83D5D"
      }
    ],
    "S04_DATA_AND_VERIFICATION": [
      {
        "id": "s04.demo0814::00_阅读说明/README.md",
        "schema_version": "0.1.0",
        "content_hash": "F6CF07F25AC0B638F3C85EBFFF3406E1A500AB548EC8011DCD48BBA1C9993365"
      },
      {
        "id": "s04.demo0814::00_阅读说明/数据使用清单.csv",
        "schema_version": "0.1.0",
        "content_hash": "E4B90363E2B077CAA8E01BED579B892F747ADAD597F4304E0883232CD7AC5ADB"
      },
      {
        "id": "s04.demo0814::00_阅读说明/数据文件关系图.svg",
        "schema_version": "0.1.0",
        "content_hash": "9D2CDF53B13E12CA0592DB1613041798967E00D6D4EEEA6A4D033485FA504B36"
      },
      {
        "id": "s04.demo0814::01_核心输入与规则/01_event_seed_table.csv",
        "schema_version": "0.1.0",
        "content_hash": "621EBDB7C980127E7B1EB18C7FA6DF2EF57E32131081711D507BA93FF188A264"
      },
      {
        "id": "s04.demo0814::01_核心输入与规则/02_jsoc_query_manifest.csv",
        "schema_version": "0.1.0",
        "content_hash": "CA03A7C677670CA8C5BB2C89D7902B0A1DFF5DF78B56F1131FAF44C4F50DFCC2"
      },
      {
        "id": "s04.demo0814::01_核心输入与规则/03_event_provenance_audit.csv",
        "schema_version": "0.1.0",
        "content_hash": "EA83BFC9B4F8ABAB4AF4A1CA5A359197DDB165C4865A708C044FBA694E77FF08"
      },
      {
        "id": "s04.demo0814::01_核心输入与规则/04_数据处理规则.md",
        "schema_version": "0.1.0",
        "content_hash": "4482A592019EAA6714E1C217D11907015DE0200A189E3D77B0E1351386260015"
      },
      {
        "id": "s04.demo0814::01_核心输入与规则/05_DataPlan.md",
        "schema_version": "0.1.0",
        "content_hash": "1E8D0B28C4F94D4C0E8E64CCF453288D19AF3234D5D4EADB2D47E0157EF2D618"
      },
      {
        "id": "s04.demo0814::01_核心输入与规则/06_QUALITY位掩码处理规则.md",
        "schema_version": "0.1.0",
        "content_hash": "D28B15E199BF7CDF1FBF688124D7703A0C2A2C1BF0BB51CE616050CD82FC45E1"
      },
      {
        "id": "s04.demo0814::01_核心输入与规则/raw_jsoc_keywords/NOAA11158_X2.2_20110215.json",
        "schema_version": "0.1.0",
        "content_hash": "3DEA4F774F76B33644FC52D3A07B83D38974782419AE6D9679F144DB4FF984A2"
      },
      {
        "id": "s04.demo0814::01_核心输入与规则/raw_jsoc_keywords/NOAA11429_X5.4_20120307.json",
        "schema_version": "0.1.0",
        "content_hash": "652298E8F20B9450FCC4FDAB94DC427E15A46C2BFF3D2B235C8DF42DBE38D5AD"
      },
      {
        "id": "s04.demo0814::01_核心输入与规则/raw_jsoc_keywords/NOAA11520_X1.4_20120712.json",
        "schema_version": "0.1.0",
        "content_hash": "A9A9A4C3D34A6410F834ED708EA6EFB88E9EB695A8D8DD3FCDB46739EE2A0AEA"
      },
      {
        "id": "s04.demo0814::01_核心输入与规则/raw_jsoc_keywords/NOAA12192_X1.1_20141019.json",
        "schema_version": "0.1.0",
        "content_hash": "E829E46791053084F77CF73ED1B169D2AB3324BA13B097E59121AFD7622D5735"
      },
      {
        "id": "s04.demo0814::01_核心输入与规则/raw_jsoc_keywords/NOAA12297_X2.1_20150311.json",
        "schema_version": "0.1.0",
        "content_hash": "A5F9236711EE717DF966CE4ED13971AC41DB193232631B840E6A8E96C73C6864"
      },
      {
        "id": "s04.demo0814::01_核心输入与规则/raw_jsoc_keywords/NOAA12673_X9.3_20170906.json",
        "schema_version": "0.1.0",
        "content_hash": "59CA283310078B9DD03273466770B6476DDEC0772438606B648EF1C667DC5128"
      },
      {
        "id": "s04.demo0814::02_主运行记录/01_all_returned_records_with_final_status.csv",
        "schema_version": "0.1.0",
        "content_hash": "7568E5385A9CA12932DE68DC7D263D405EF0BCDB2E311A932E349E06537CD200"
      },
      {
        "id": "s04.demo0814::02_主运行记录/02_gate_counts.csv",
        "schema_version": "0.1.0",
        "content_hash": "6AC53E5E542177A9F80F9BA853C34E87CEF3F9E7730CE5ECCA669FA9A6F93DC5"
      },
      {
        "id": "s04.demo0814::02_主运行记录/03_quality_bit_policy.csv",
        "schema_version": "0.1.0",
        "content_hash": "AA1726A6B89E5C427737EE023F66E58337A0EE09247831EBBFBBC6E8000B1D08"
      },
      {
        "id": "s04.demo0814::02_主运行记录/04_cadence_audit.csv",
        "schema_version": "0.1.0",
        "content_hash": "D01D0C595FE8C514069CC8FF5B921D5F1D675293BA469A9931EE576A21A5589E"
      },
      {
        "id": "s04.demo0814::03_最终Demo结果/01_final_analysis_sample.csv",
        "schema_version": "0.1.0",
        "content_hash": "8CFE35504EF599191FA85776984025FE679D20801A72678E64DB512B26AFFB4C"
      },
      {
        "id": "s04.demo0814::03_最终Demo结果/02_continuous_distribution.csv",
        "schema_version": "0.1.0",
        "content_hash": "2F297781621413E6F483CD3DEF3D2B5C1E7CD7281070415C77791EFC1C8B897D"
      },
      {
        "id": "s04.demo0814::03_最终Demo结果/03_usflux_context_correlation.csv",
        "schema_version": "0.1.0",
        "content_hash": "FCC712F45900D90F7C6867D6DA97E7258341628990E544142CD1B4C75013830A"
      },
      {
        "id": "s04.demo0814::04_control审计与替换依据/01_final_control_audit.csv",
        "schema_version": "0.1.0",
        "content_hash": "1510986BDE12BD84C46A130BA85CDCE1F4D847815C712C280C64BE9EF038E238"
      },
      {
        "id": "s04.demo0814::04_control审计与替换依据/02_final_control_replacements.csv",
        "schema_version": "0.1.0",
        "content_hash": "C754A147678621F7173B3A5AFBF3D18F1A2173F7114A96FBB237D5216D4CD10E"
      },
      {
        "id": "s04.demo0814::04_control审计与替换依据/03_official_Mplus_event_catalog_NCEI_subset.csv",
        "schema_version": "0.1.0",
        "content_hash": "58403AA32F014AC9A9341E7D52F46DA8DB1F03ED54BDEAB2DC4592E6B8906531"
      },
      {
        "id": "s04.demo0814::04_control审计与替换依据/04_NCEI目录来源说明.csv",
        "schema_version": "0.1.0",
        "content_hash": "A58CA5C5D7431738DCBF1A7484EBB5D72BAACD30567A9D2FA8296430E2B69526"
      },
      {
        "id": "s04.demo0814::04_control审计与替换依据/05_AR11429候选更正审计.csv",
        "schema_version": "0.1.0",
        "content_hash": "683766337CF3EB604F3BDDDD9DAC67071024E90F4966443435223F9D045F8F62"
      },
      {
        "id": "s04.demo0814::04_control审计与替换依据/06_严格数据门汇总.csv",
        "schema_version": "0.1.0",
        "content_hash": "F92D11B60192C73F0C10B364EF6A840E34D713FC5E66164B30C95550EA1D3260"
      },
      {
        "id": "s04.demo0814::04_control审计与替换依据/07_候选T0与NCEI区间审计.csv",
        "schema_version": "0.1.0",
        "content_hash": "92FAF0C36D0F2FFF2F9CF6E9B398DCCFC091B089CF7F1092193E6B52928A6FBB"
      },
      {
        "id": "s04.demo0814::04_control审计与替换依据/08_候选时间块选择审计.csv",
        "schema_version": "0.1.0",
        "content_hash": "16E7E5F727479E25A58388012AF4570310B014FBE4221F4BD70620D90C86A41B"
      },
      {
        "id": "s04.demo0814::04_control审计与替换依据/09_活动区最终选择摘要.csv",
        "schema_version": "0.1.0",
        "content_hash": "FC747CCDED8EDDF99105D6FB0AB2C2A7B52BC38960BB55ACD61C9D9DD7A82E13"
      },
      {
        "id": "s04.demo0814::04_control审计与替换依据/10_全量目录清洁候选门控.csv",
        "schema_version": "0.1.0",
        "content_hash": "6C4F796021FC22DCC05090A1164AAFE05B55C9CD30BEE306A072773DFD6C3695"
      },
      {
        "id": "s04.demo0814::04_control审计与替换依据/11_逐帧关键词核验.csv",
        "schema_version": "0.1.0",
        "content_hash": "1719E5371B7569CCD036141B27BD4C726335C7B07DDC9486449DD7A1CD50B8FE"
      },
      {
        "id": "s04.demo0814::04_control审计与替换依据/12_JSOC重取清单.csv",
        "schema_version": "0.1.0",